[
  {
    "id": "youtube-jzgcwczxh1i",
    "type": "youtube",
    "source": "YouTube",
    "title": "Claude Code Dynamic Workflows Clearly Explained",
    "url": "https://www.youtube.com/watch?v=jZgcWCzxh1I",
    "author": "nateherk",
    "published": "2026-05-30T17:34:30+00:00",
    "tags": [
      "YouTube"
    ],
    "summary": "Selected AI/dev YouTube signal from the curated favorite-creator list.",
    "why_it_matters": "Useful for spotting practical tools, coding workflow shifts, and adjacent AI opportunities from your favorite yters without scanning YouTube manually.",
    "thumbnail": "https://i.ytimg.com/vi/jZgcWCzxh1I/hqdefault.jpg",
    "score": 74,
    "updated_at": "2026-05-31T17:12:04.913Z"
  },
  {
    "id": "github-santifer-career-ops",
    "type": "github",
    "source": "GitHub",
    "title": "santifer/career-ops",
    "url": "https://github.com/santifer/career-ops",
    "author": "santifer",
    "published": "2026-04-04T18:21:18Z",
    "tags": [
      "ai agent",
      "anthropic",
      "automation",
      "career",
      "GitHub"
    ],
    "summary": "AI-powered job search system built on Claude Code. 14 skill modes, Go dashboard, PDF generation, batch processing.",
    "why_it_matters": "Strong fit for operator leverage, agent workflows, and business automation ideas.",
    "score": 99,
    "metrics": {
      "stars": 48013,
      "forks": 9988,
      "language": "JavaScript"
    },
    "updated_at": "2026-05-31T17:12:04.912Z"
  },
  {
    "id": "youtube-n7b1pjc7sfc",
    "type": "youtube",
    "source": "YouTube",
    "title": "Engineering voice agents: Latency, quality, and scale — Rishabh Bhargava, Together AI",
    "url": "https://www.youtube.com/watch?v=N7b1PJc7SFc",
    "author": "AI Engineer",
    "published": "2026-05-31T16:00:06+00:00",
    "tags": [
      "YouTube"
    ],
    "summary": "Selected AI/dev YouTube signal from the curated favorite-creator list.",
    "why_it_matters": "Useful for spotting practical tools, coding workflow shifts, and adjacent AI opportunities from your favorite yters without scanning YouTube manually.",
    "thumbnail": "https://i.ytimg.com/vi/N7b1PJc7SFc/hqdefault.jpg",
    "score": 70,
    "updated_at": "2026-05-31T17:12:04.913Z"
  },
  {
    "id": "github-ultraworkers-claw-code",
    "type": "github",
    "source": "GitHub",
    "title": "ultraworkers/claw-code",
    "url": "https://github.com/ultraworkers/claw-code",
    "author": "ultraworkers",
    "published": "2026-03-31T08:58:08Z",
    "tags": [
      "GitHub"
    ],
    "summary": "The repo is finally unlocked. enjoy the party! The fastest repo in history to surpass 100K stars ⭐. Join Discord: https://discord.gg/5TUQKqFWd Built in Rust using oh-my-codex.",
    "why_it_matters": "Potentially useful signal for the morning AI digest and fast-moving product patterns.",
    "score": 99,
    "metrics": {
      "stars": 192982,
      "forks": 109974,
      "language": "Rust"
    },
    "updated_at": "2026-05-31T17:12:04.912Z"
  },
  {
    "id": "youtube-5zdvwxeouq0",
    "type": "youtube",
    "source": "YouTube",
    "title": "Step-3.7 Flash FULLY FREE Unlimited API + Hermes Agent: THIS IS ACTUALLY CRAZY!",
    "url": "https://www.youtube.com/watch?v=5zdvwxEouQ0",
    "author": "AICodeKing",
    "published": "2026-05-31T10:36:44+00:00",
    "tags": [
      "YouTube"
    ],
    "summary": "Selected AI/dev YouTube signal from the curated favorite-creator list.",
    "why_it_matters": "Useful for spotting practical tools, coding workflow shifts, and adjacent AI opportunities from your favorite yters without scanning YouTube manually.",
    "thumbnail": "https://i.ytimg.com/vi/5zdvwxEouQ0/hqdefault.jpg",
    "score": 70,
    "updated_at": "2026-05-31T17:12:04.913Z"
  },
  {
    "id": "github-garrytan-gstack",
    "type": "github",
    "source": "GitHub",
    "title": "garrytan/gstack",
    "url": "https://github.com/garrytan/gstack",
    "author": "garrytan",
    "published": "2026-03-11T21:22:45Z",
    "tags": [
      "GitHub"
    ],
    "summary": "Use Garry Tan's exact Claude Code setup: 23 opinionated tools that serve as CEO, Designer, Eng Manager, Release Manager, Doc Engineer, and QA",
    "why_it_matters": "Potentially useful signal for the morning AI digest and fast-moving product patterns.",
    "score": 99,
    "metrics": {
      "stars": 105041,
      "forks": 15663,
      "language": "TypeScript"
    },
    "updated_at": "2026-05-31T17:12:04.912Z"
  },
  {
    "id": "youtube-gs-tg-nszbo",
    "type": "youtube",
    "source": "YouTube",
    "title": "Selling Runify: Quick Valuation, High Multiplier! #shorts",
    "url": "https://www.youtube.com/watch?v=gS_tg-nSZBo",
    "author": "SuperwallHQ",
    "published": "2026-05-31T15:54:52+00:00",
    "tags": [
      "YouTube"
    ],
    "summary": "Selected AI/dev YouTube signal from the curated favorite-creator list.",
    "why_it_matters": "Useful for spotting practical tools, coding workflow shifts, and adjacent AI opportunities from your favorite yters without scanning YouTube manually.",
    "thumbnail": "https://i.ytimg.com/vi/gS_tg-nSZBo/hqdefault.jpg",
    "score": 64,
    "updated_at": "2026-05-31T17:12:04.913Z"
  },
  {
    "id": "github-affaan-m-ecc",
    "type": "github",
    "source": "GitHub",
    "title": "affaan-m/ECC",
    "url": "https://github.com/affaan-m/ECC",
    "author": "affaan-m",
    "published": "2026-01-18T00:51:51Z",
    "tags": [
      "ai agents",
      "anthropic",
      "claude",
      "claude code",
      "GitHub"
    ],
    "summary": "The agent harness performance optimization system. Skills, instincts, memory, security, and research-first development for Claude Code, Codex, Opencode, Cursor and beyond.",
    "why_it_matters": "Relevant to Jarvis, AI workflows, and product ideas worth monitoring closely.",
    "score": 99,
    "metrics": {
      "stars": 200104,
      "forks": 30715,
      "language": "JavaScript"
    },
    "updated_at": "2026-05-31T17:12:04.912Z"
  },
  {
    "id": "youtube-3amwv9fiu4o",
    "type": "youtube",
    "source": "YouTube",
    "title": "The New Codex Feature Nobody Knew They Needed",
    "url": "https://www.youtube.com/watch?v=3aMWv9FIu4o",
    "author": "RAmjad",
    "published": "2026-05-31T15:47:27+00:00",
    "tags": [
      "YouTube"
    ],
    "summary": "Selected AI/dev YouTube signal from the curated favorite-creator list.",
    "why_it_matters": "Useful for spotting practical tools, coding workflow shifts, and adjacent AI opportunities from your favorite yters without scanning YouTube manually.",
    "thumbnail": "https://i.ytimg.com/vi/3aMWv9FIu4o/hqdefault.jpg",
    "score": 64,
    "updated_at": "2026-05-31T17:12:04.913Z"
  },
  {
    "id": "github-openclaw-openclaw",
    "type": "github",
    "source": "GitHub",
    "title": "openclaw/openclaw",
    "url": "https://github.com/openclaw/openclaw",
    "author": "openclaw",
    "published": "2025-11-24T10:16:47Z",
    "tags": [
      "ai",
      "assistant",
      "crustacean",
      "molty",
      "GitHub"
    ],
    "summary": "Your own personal AI assistant. Any OS. Any Platform. The lobster way. 🦞",
    "why_it_matters": "Relevant to Jarvis, AI workflows, and product ideas worth monitoring closely.",
    "score": 99,
    "metrics": {
      "stars": 375830,
      "forks": 78461,
      "language": "TypeScript"
    },
    "updated_at": "2026-05-31T17:12:04.912Z"
  },
  {
    "id": "youtube-z4lcioz7-g",
    "type": "youtube",
    "source": "YouTube",
    "title": "Claude Opus 4.8 Free Without Paying Upfront, 3 Tools That Skip the API Bill",
    "url": "https://www.youtube.com/watch?v=Z4LcioZ7_-g",
    "author": "AIStackStudio-f2x",
    "published": "2026-05-31T13:59:51+00:00",
    "tags": [
      "YouTube"
    ],
    "summary": "Selected AI/dev YouTube signal from the curated favorite-creator list.",
    "why_it_matters": "Useful for spotting practical tools, coding workflow shifts, and adjacent AI opportunities from your favorite yters without scanning YouTube manually.",
    "thumbnail": "https://i.ytimg.com/vi/Z4LcioZ7_-g/hqdefault.jpg",
    "score": 64,
    "updated_at": "2026-05-31T17:12:04.913Z"
  },
  {
    "id": "github-obra-superpowers",
    "type": "github",
    "source": "GitHub",
    "title": "obra/superpowers",
    "url": "https://github.com/obra/superpowers",
    "author": "obra",
    "published": "2025-10-09T19:45:18Z",
    "tags": [
      "GitHub"
    ],
    "summary": "An agentic skills framework & software development methodology that works.",
    "why_it_matters": "Potentially useful signal for the morning AI digest and fast-moving product patterns.",
    "score": 99,
    "metrics": {
      "stars": 213566,
      "forks": 19022,
      "language": "Shell"
    },
    "updated_at": "2026-05-31T17:12:04.912Z"
  },
  {
    "id": "youtube-dp-iftago9g",
    "type": "youtube",
    "source": "YouTube",
    "title": "If your startup is in the crosshairs of OpenAI or Anthropic, you're already done.",
    "url": "https://www.youtube.com/watch?v=dP_iFTagO9g",
    "author": "Itssssss_Jack",
    "published": "2026-05-31T11:56:25+00:00",
    "tags": [
      "YouTube"
    ],
    "summary": "Selected AI/dev YouTube signal from the curated favorite-creator list.",
    "why_it_matters": "Useful for spotting practical tools, coding workflow shifts, and adjacent AI opportunities from your favorite yters without scanning YouTube manually.",
    "thumbnail": "https://i.ytimg.com/vi/dP_iFTagO9g/hqdefault.jpg",
    "score": 64,
    "updated_at": "2026-05-31T17:12:04.913Z"
  },
  {
    "id": "github-anthropics-skills",
    "type": "github",
    "source": "GitHub",
    "title": "anthropics/skills",
    "url": "https://github.com/anthropics/skills",
    "author": "anthropics",
    "published": "2025-09-22T15:53:31Z",
    "tags": [
      "agent skills",
      "GitHub"
    ],
    "summary": "Public repository for Agent Skills",